{
  "billingFrequencyName": "eiusmod cupidatat",
  "name": "ut tempor est magna",
  "id": "incididunt occaecat",
  "auditInfo": {
    "isDeleted": false,
    "createdBy": "aliquip tempor",
    "updatedBy": "et",
    "updatedDate": "2014-11-13T20:16:24.482Z",
    "createdDate": "1956-04-09T21:25:51.962Z"
  }
}
